,Date,Headline
2516,2024-05-31 05:00:32+00:00,Dutch MPs call for inquiry into reports Israel spied on ICC lawyers
2517,2024-05-31 10:00:38+00:00,New York hospital fires nurse after calling Gaza war a ‘genocide’ in speech
2518,2024-05-31 11:50:19+00:00,‘Solidarity over hatred’: the small band of Israelis stopping settlers obstructing aid trucks
2519,2024-05-31 13:41:57+00:00, ‘Labour will struggle’: Birmingham voters in a bind – and not just over Gaza
2520,2024-05-31 14:02:47+00:00,Israel-Gaza war: IDF says its troops have ended operations in eastern Jabaliya – as it happened
2521,2024-05-31 16:22:43+00:00,"In Gaza, as in Britain, we need justice, not punishment | Letter"
2522,2024-05-31 18:29:40+00:00,New review by UK ministers again finds no reason to stop arms exports to Israel
2523,2024-05-31 21:05:33+00:00,Biden urges Hamas to accept Israeli plan for Gaza ceasefire: ‘Time for this war to end’
2524,2024-06-01 10:19:31+00:00,Should academic institutions boycott Israel? Two scholars debate | Flora Cassen and Ilan Pappé
2525,2024-06-01 14:57:22+00:00,Israel’s opposition leader urges Netanyahu to accept ceasefire proposal – as it happened
2526,2024-06-01 15:55:05+00:00,Benjamin Netanyahu insists on Hamas ‘destruction’ as part of plan to end Gaza war
2527,2024-06-01 18:15:35+00:00,Biden’s botched Gaza ceasefire deal only demonstrates his lack of influence | Julian Borger
2528,2024-06-01 20:00:11+00:00,Dutton is demanding Australia resist ICC arrest warrants for Israeli leaders – and a Howard-era law could help him
2529,2024-06-02 05:00:23+00:00,Children die of malnutrition as Rafah operation heightens threat of famine in Gaza
2530,2024-06-02 11:00:01+00:00,A House in Jerusalem review – child-friendly but languid Israeli-Palestinian history lesson
2531,2024-06-02 12:28:46+00:00,"For Labour, the Gaza crisis is a foreign policy tightrope in waiting"
2532,2024-06-02 15:13:18+00:00,"Israel accepts Biden’s Gaza plan but it ‘is not a good deal’, says Netanyahu aide – as it happened"
2533,2024-06-02 16:14:34+00:00,Netanyahu tries to avoid coalition implosion over Gaza ceasefire plan
2534,2024-06-02 19:00:36+00:00,More than 100 artists tell Starmer to halt arms sales to Israel if he becomes PM
2535,2024-06-03 00:54:17+00:00,Maldives to ban Israeli passport holders from entry in protest over Gaza war
2536,2024-06-03 04:00:24+00:00,"Trade convoys ‘squeezing out’ Gaza aid, humanitarian organisations say"
2537,2024-06-03 06:00:26+00:00,I’m glad Slovenia is recognising Palestine at last – but why did my country hesitate for so long? | Ana Schnabl
2538,2024-06-03 07:12:55+00:00,‘Reckless’: Penny Wong condemns Peter Dutton’s threats to cut ties with International Criminal Court
2539,2024-06-03 08:30:53+00:00,Former ADF chief to report on Zomi Frankcom’s Gaza aid convoy death in ‘coming weeks’ – as it happened
2540,2024-06-03 10:22:16+00:00,"Hamas still strong in areas ‘cleared’ by Israel in northern Gaza, say experts"
2541,2024-06-03 15:06:08+00:00,"Israel-Gaza war: Biden only published partial version of Gaza ceasefire proposal, says Netanyahu – as it happened"
2542,2024-06-03 18:54:32+00:00,White House says ‘ball in Hamas’s court’ over Gaza peace proposal
2543,2024-06-03 22:39:16+00:00,Benjamin Netanyahu set to address joint session of US Congress for fourth time
2544,2024-06-04 05:27:29+00:00,"Pro-Palestine protests closing MPs’ electorate offices ‘have no place in a democracy’, Albanese says"
2545,2024-06-04 06:41:20+00:00,Afternoon Update: PM denounces pro-Palestine protests at Labor offices; P&O Cruises Australia to shut down; and X changes porn policy
2546,2024-06-04 08:37:25+00:00,Wong calls for Gaza ceasefire saying ‘this war must end’ – as it happened
2547,2024-06-04 10:00:10+00:00,BDS founder hails campus protests for taking Israeli divestment mainstream
2548,2024-06-04 10:26:50+00:00,First Thing: Biden to issue order on new restrictions at US-Mexico border 
2549,2024-06-04 17:34:08+00:00,Pressure grows on Benjamin Netanyahu to back Gaza ceasefire plan
2550,2024-06-04 17:38:02+00:00,Biden: ‘every reason’ to believe Netanyahu is prolonging Gaza war for political gain
2551,2024-06-05 02:00:09+00:00,Jerusalem braces for Israeli nationalist flag march through Muslim Quarter
2552,2024-06-05 02:15:21+00:00,Radiohead’s Jonny Greenwood calls backlash over Israel show amid Gaza war ‘unprogressive’
2553,2024-06-05 08:09:01+00:00,Bandt hits back after Albanese and Dutton accuse Greens of inflaming Gaza protests
2554,2024-06-05 12:27:17+00:00,Baillie Gifford will no longer sponsor Borders and Cheltenham literature festivals
2555,2024-06-05 12:33:45+00:00,Guardian’s Lorenzo Tondo wins Italy’s prestigious Premiolino award 
2556,2024-06-05 14:30:51+00:00,"Israel-Gaza war: Israel prepared for ‘strong action’ in north near Lebanon, says Netanyahu – as it happened"
2557,2024-06-05 15:00:27+00:00,"Australia only granted defence export permits to Israel for repair of equipment since conflict, estimates told"
2558,2024-06-05 16:39:15+00:00,Netanyahu threatens ‘extremely powerful’ response to Hezbollah attacks
2559,2024-06-05 16:45:04+00:00,Clashes in Jerusalem as thousands of Israelis parade through Muslim quarter
2560,2024-06-05 17:20:31+00:00,"Starvation already causing many deaths and lasting harm in Gaza, agencies say"
2561,2024-06-05 20:00:31+00:00,Corrections and clarifications
2562,2024-06-05 21:54:24+00:00,Police arrest student protesters who occupied Stanford president’s office
2563,2024-06-06 01:34:38+00:00,Adam Bandt threatens Mark Dreyfus with legal action over comments on pro-Palestine protests
2564,2024-06-06 04:00:43+00:00,‘Sometimes I wonder if I’ll come back’: Palestinian birdwatchers defy danger to scan the skies
2565,2024-06-06 04:09:56+00:00,ANU student Beatrice Tucker expelled after saying Hamas deserved ‘unconditional support’ during radio interview
2566,2024-06-06 07:01:19+00:00,Revealed: repairing Israel’s destruction of Gaza will come at huge climate cost
2567,2024-06-06 08:19:59+00:00,Dutton calls Greens ‘evil’ and claims Bandt ‘unfit for public office’ as tensions over Gaza war continue
2568,2024-06-06 10:01:01+00:00,A US hospital fired an acclaimed nurse for talking about Gaza. Where’s the outrage? | Bhaskar Sunkara
2569,2024-06-06 10:19:39+00:00,First Thing: Dozens killed in Israeli strike on UN school as IDF launches central Gaza operation
2570,2024-06-06 11:16:24+00:00,"Dozens killed in Israeli strike on UN school, witnesses say"
2571,2024-06-06 14:12:05+00:00,Israel-Gaza war: dozens reported killed after Israeli strike on UN school in refugee camp – as it happened
2572,2024-06-06 14:29:20+00:00,Biden wants an end to the Gaza war. But he is finally realising Netanyahu will block any attempts at peace | Alon Pinkas
2573,2024-06-06 16:54:43+00:00,Why are Democrats blindly embracing Netanyahu? | Jo-Ann Mort
2574,2024-06-06 18:15:25+00:00,Keir Starmer expected to push for Palestinian state in Labour manifesto
2575,2024-06-06 20:17:16+00:00,NAACP calls on Biden-Harris to halt weapons to Israel and push for ceasefire
2576,2024-06-07 04:30:40+00:00,"‘We have normalised horror’ says agency official, after Israeli strike on school"
2577,2024-06-07 05:40:10+00:00,Friday briefing: The ‘two immovable obstacles’ to ending the war in Gaza
2578,2024-06-07 12:40:58+00:00,‘People feel betrayed by Labour’: Bristol’s Green surge continues
2579,2024-06-07 14:00:05+00:00,"Israel-Gaza war: Gaza facing Israeli attacks from land, sea, and air, witnesses report – as it happened"
2580,2024-06-07 15:00:20+00:00,It seems everyone is angry these days and the prime minister is no exception | Karen Middleton
2581,2024-06-07 15:51:30+00:00,Survivors of Israeli strike on Gaza school describe finding children’s bodies
2582,2024-06-07 16:32:49+00:00,US warns Israel against war with Hezbollah
2583,2024-06-07 17:30:22+00:00,The Guardian view on Gaza’s unending war: a deal is as distant as ever – but more essential
2584,2024-06-07 17:43:09+00:00,UN adds Israel to list of states committing violations against children
2585,2024-06-08 09:00:42+00:00,Israeli peaceniks in the US didn’t find a home in the Gaza protests. So they started their own
2586,2024-06-08 10:00:43+00:00,Palestinian author Raja Shehadeh: ‘All this solidarity from the world – yet nothing has changed’
2587,2024-06-08 10:00:44+00:00,Israel has destroyed or damaged 80% of schools in Gaza. This is scholasticide | Chandni Desai
2588,2024-06-08 15:05:11+00:00,Israel-Gaza war: four hostages from Nova music festival rescued in central Gaza – as it happened
2589,2024-06-08 19:14:41+00:00,"Israel rescues four hostages in Gaza, as attacks nearby kill at least 93 Palestinians"
2590,2024-06-08 20:00:32+00:00,Thousands gather at White House for pro-Palestinian protest
2591,2024-06-09 00:00:04+00:00,Fact check: is Australia exporting weapons to Israel?
2592,2024-06-09 06:05:37+00:00,Labor urged to step up pressure on Israel – as it happened
2593,2024-06-09 09:49:51+00:00,Outgoing federal Labor MP backs Palestinian-Australian to replace her in Melbourne seat of Calwell
2594,2024-06-09 15:00:21+00:00,"More transparency needed on exports to Israel after Greens ‘exploited’ information vacuum, Labor says"
2595,2024-06-09 15:56:23+00:00,"Hamas claims three hostages died, including US citizen, in Israel raid that killed more than 200 Palestinians – as it happened"
2596,2024-06-09 16:05:15+00:00,Israeli joy at hostage rescue undiminished by regret over Palestinian casualties
2597,2024-06-09 16:30:19+00:00,Hamas: The Quest for Power review – the men behind the masks
2598,2024-06-09 16:38:38+00:00,Outrage over ‘massacre’ in Gaza as Israel rescued four hostages 
2599,2024-06-09 20:27:14+00:00,‘Like the horrors of judgment day’: the cost to Palestinians of Israel’s hostage rescue
2600,2024-06-09 20:42:41+00:00,Moderate politician Benny Gantz resigns from Israeli war cabinet
2601,2024-06-10 04:00:34+00:00,"Talkshows, TikTok, Gaza: George Galloway and Rochdale, 100 days on"
2602,2024-06-10 04:19:37+00:00,US-made Gaza pier resumes aid shipments after storm damage 
2603,2024-06-10 04:57:17+00:00,Australian company denies Greens’ accusations it exports parts for Israeli missiles used in Gaza 
2604,2024-06-10 11:00:14+00:00,‘It wasn’t easy to be on camera’: Succession’s Hiam Abbass on reliving her departure from Palestine
2605,2024-06-10 14:07:16+00:00,"Israel-Gaza war: ‘sense of urgency’ to secure immediate ceasefire, says Blinken – as it happened"
2606,2024-06-10 14:38:49+00:00,US to ask UN security council to back Joe Biden’s Gaza peace deal
2607,2024-06-10 15:00:18+00:00,‘We play every game with heart’: Palestine meet Socceroos with minds on Gaza | Joey Lynch
2608,2024-06-10 16:04:06+00:00,Prospect of Israeli hostage deal recedes as far-right minister signals opposition
2609,2024-06-10 20:59:07+00:00,"Morning Mail: Coalition reignites climate wars, security council endorses Gaza ceasefire plan, Titmus sends Paris warning"
2610,2024-06-10 21:05:56+00:00,UN security council endorses US-backed hostages-for-ceasefire Gaza deal
2611,2024-06-11 10:36:54+00:00,Hamas says it accepts UN ceasefire resolution | First Thing
2612,2024-06-11 12:09:30+00:00,UK has issued 108 arms export licences to Israel since 7 October
2613,2024-06-11 14:04:29+00:00,"Israel-Gaza war: ‘talks ongoing’ but no formal response to ceasefire proposal from either side, says official – as it happened"
2614,2024-06-11 15:53:32+00:00,Australia make it six from six with World Cup qualifier win over Palestine
2615,2024-06-11 17:02:05+00:00," ‘Unprecedented scale’ of violations against children in Gaza, West Bank and Israel, UN report says"
2616,2024-06-11 17:43:12+00:00,We watched Ivy League law reviews censor Palestinian scholars first-hand | Erika Lopez and Tascha Shahriari-Parsa
2617,2024-06-11 18:14:25+00:00,"Biden generally favored abroad aside from Israel-Gaza war handling, poll finds"
2618,2024-06-11 20:00:05+00:00,Corrections and clarifications
2619,2024-06-11 20:49:37+00:00,"Morning Mail: Hunter Biden found guilty, capital city rents fall, UN reports ‘grave violations’ against children in Gaza"
2620,2024-06-12 07:05:50+00:00,US ‘evaluating’ Hamas response to Gaza ceasefire proposal
2621,2024-06-12 11:42:15+00:00,Hunter Biden found guilty in federal gun case | First Thing
2622,2024-06-12 11:46:19+00:00,Multiple bands pull out of Download festival over Barclays’ Israel ties
2623,2024-06-12 14:03:09+00:00,"Hamas has proposed ‘unworkable’ changes to ceasefire plan, Blinken says – as it happened"
2624,2024-06-12 16:45:52+00:00,"Israel and Hamas have both committed war crimes since 7 October, says UN body"
2625,2024-06-12 17:41:28+00:00,Hezbollah fires big salvo of rockets at Israel after senior commander killed
2626,2024-06-13 04:00:16+00:00,Conflicts drive number of forcibly displaced people to record high
2627,2024-06-13 09:36:39+00:00,Unrwa accuses Israel of frequently preventing aid deliveries to Gaza
2628,2024-06-13 14:56:26+00:00,The international criminal court should investigate Israel’s hostage rescue raid | Kenneth Roth
2629,2024-06-13 17:58:13+00:00,Israeli tanks advance in Rafah as fleeing Palestinians ‘face death and starvation’
2630,2024-06-14 06:39:24+00:00,Afternoon Update: Teal MP’s seat facing abolition; attempted murder charge over Wakeley stabbing; and Elon Musk’s $68bn pay package
2631,2024-06-14 07:27:08+00:00,Police investigate after pro-Palestinian slogans graffitied on Canberra war memorial – as it happened
2632,2024-06-14 09:30:20+00:00,"Australian War Memorial allegedly defaced with pro-Palestine graffiti, police say"
2633,2024-06-14 11:13:22+00:00,Hamas official says nobody knows how many hostages are still alive | First Thing
2634,2024-06-14 14:22:15+00:00,"Barclays suspends sponsorship of Download, Latitude and Isle of Wight festivals"
2635,2024-06-14 14:34:58+00:00,Middle East: Hamas official says nobody knows how many of the remaining hostages are alive – as it happened
2636,2024-06-14 15:14:52+00:00,"‘No one has any idea’ how many Israeli hostages are alive, says Hamas official"
2637,2024-06-14 18:49:46+00:00,US imposes sanctions on ‘extremist Israeli group’ for blocking Gaza aid
2638,2024-06-14 19:12:09+00:00,"When protests cross into antisemitism, it hurts the Palestinian cause | Jo-Ann Mort"
2639,2024-06-14 20:54:36+00:00,Pro-Palestinian Canadian students’ post for ‘teach-in’ features masked guerrillas
2640,2024-06-15 16:02:29+00:00,"Eight Israeli soldiers killed in southern Gaza, military says"
2641,2024-06-15 17:51:55+00:00,"Israel has fallen into Hamas trap in Gaza war, says Giorgia Meloni at G7"
2642,2024-06-15 18:23:35+00:00,Israel is fighting a war on two fronts. No end is in sight for either one | Peter Beaumont
2643,2024-06-16 05:00:42+00:00,Labour sends activists to 13 seats where it fears losing Muslim voters over Gaza 
2644,2024-06-16 09:52:42+00:00,"UK ‘morally incoherent’ for sending arms to Israel and aid to Gaza, says Oxfam chief"
2645,2024-06-16 10:00:48+00:00,‘No pride in occupation’: queer Palestinians on ‘pink-washing’ in Gaza conflict
2646,2024-06-16 13:21:22+00:00,Israeli military announces daily ‘tactical pause’ in southern Gaza to allow in aid
2647,2024-06-16 18:37:14+00:00,Democrat Khanna: Biden is ‘running out of time’ with young voters over Gaza war
2648,2024-06-16 23:41:45+00:00,Netanyahu reportedly criticises military tactical pause in Gaza amid divisions with IDF
2649,2024-06-17 05:16:23+00:00,"‘Can’t look away’: Israel-Gaza war driving rise in news consumption among gen Z Australians, report suggests"
2650,2024-06-17 06:46:49+00:00,Melbourne Black Star Pastry employees sacked after wearing the keffiyeh at work
2651,2024-06-17 11:34:54+00:00,Download festival review – the rock fest’s most cursed year ever
2652,2024-06-17 14:00:49+00:00,Benjamin Netanyahu dissolves Israel’s war cabinet – as it happened
2653,2024-06-17 14:21:48+00:00,US envoy visits Israel for talks aimed at averting deeper conflict with Hezbollah
2654,2024-06-17 14:26:34+00:00,Benjamin Netanyahu dissolves Israeli war cabinet 
2655,2024-06-17 16:39:44+00:00,Netanyahu’s ‘war cabinet’ had little power – but its demise does him real damage | Alon Pinkas
2656,2024-06-17 16:53:13+00:00,The normalisation of dehumanisation in the Israel-Palestine conflict | Letters
2657,2024-06-17 23:01:01+00:00,Dua Lipa says criticism of Israeli war in Gaza was for ‘greater good’
2658,2024-06-18 04:27:02+00:00,Campus holdout: University of Sydney tells Gaza protesters to leave but small group vows ‘encampment has not ended’
2659,2024-06-18 08:00:07+00:00,What Does Israel Fear from Palestine? by Raja Shehadeh review – in pursuit of peace
2660,2024-06-18 10:42:23+00:00,Labor senator Fatima Payman calls on government to ‘recognise Palestine’ in rebuke to Albanese
2661,2024-06-18 12:08:01+00:00,First Thing: Putin praises North Korea’s support for Ukraine war ahead of visit
2662,2024-06-18 13:01:15+00:00,Israel-Gaza war: 17 Palestinians reportedly killed by double Israeli strike on Nuseirat refugee camp – as it happened
2663,2024-06-18 14:13:30+00:00,"At least 17 killed in Gaza refugee camps after latest Israeli strikes, say medics"
2664,2024-06-18 15:00:11+00:00,Australian Border Force questions three people suspected of travelling to join Israeli army
2665,2024-06-18 17:03:50+00:00,Ein Wort für a fear of mentioning the war | Brief letters
2666,2024-06-18 20:27:34+00:00,Israeli foreign minister says decision on all-out war against Hezbollah is near
2667,2024-06-19 12:00:07+00:00,"Chemicals from East Palestine derailment spread to 16 US states, data shows"
2668,2024-06-19 15:01:20+00:00,Israel-Gaza war: Hezbollah fires more projectiles at Israel despite warning – as it happened
2669,2024-06-19 16:58:52+00:00,White House disputes Netanyahu’s claim that US is withholding weapons from Israel
2670,2024-06-19 18:30:56+00:00,Israeli talk of war with Hezbollah almost certainly fresh attempt at deterrence
2671,2024-06-19 20:26:29+00:00,Hezbollah leader: Cyprus will be target if it lets Israel use its territory in conflict
2672,2024-06-20 05:00:28+00:00,"Starmer fighting one seat, Corbyn the one next door: a schism and a symbol of battles to come | Zoe Williams"
2673,2024-06-20 10:37:11+00:00,First Thing: Washington Post publisher allegedly advised Boris Johnson to ‘clean up’ phone amid Covid scandal
2674,2024-06-20 11:30:35+00:00,Dining across the divide: ‘It felt as if I was fighting for us to have something in common – she was living in a different world’
2675,2024-06-20 13:00:36+00:00,Activists tell UK arms makers they may face criminal liability over sales to Israel
2676,2024-06-20 14:01:35+00:00,Israel-Gaza war: Netanyahu rebukes IDF after army spokesperson warns that Hamas cannot be eliminated – now closed
2677,2024-06-20 14:32:07+00:00,IDF transfers powers in occupied West Bank to pro-settler civil servants
2678,2024-06-20 18:20:05+00:00,Cyprus stresses neutrality after Hezbollah threat over Israel war
2679,2024-06-20 21:00:02+00:00,"Morning Mail: ‘$1,000’ nuclear bill shock, Victoria’s deal with Israel, Donald Sutherland dies"
2680,2024-06-21 10:18:37+00:00,First Thing: US ‘incredibly concerned’ over Putin’s North Korea weapons pact
2681,2024-06-21 15:15:58+00:00,There’s a shocking absence in this election: politicians won’t mention the Israel-Gaza war | Owen Jones
2682,2024-06-21 16:15:48+00:00,‘All day you hear bombs’: on Israel’s northern border as war with Hezbollah looms
2683,2024-06-21 17:21:41+00:00,The Guardian view on Israel and Hezbollah: the gathering storm endangers the region | Editorial
2684,2024-06-22 03:42:18+00:00,"At least 22 Palestinians killed in shelling near Gaza office of Red Cross, agency says"
2685,2024-06-22 14:53:39+00:00,‘At least 42 killed’ in Israeli strikes in Gaza – Middle East crisis as it happened
2686,2024-06-22 15:11:27+00:00,Dozens killed in Israeli airstrikes on Gaza City
2687,2024-06-22 16:00:35+00:00,The Middle East is drifting leaderless to catastrophe. War is just an airstrike away | Simon Tisdall
2688,2024-06-23 06:00:07+00:00,‘They miscalculated’: Gaza’s floating aid pier failing to deliver in rough seas
2689,2024-06-23 09:00:10+00:00,Jess Phillips on campaign trail: ‘I’m trying to remind people we have power to change things’
2690,2024-06-23 09:00:11+00:00,"Israel’s Iron Dome risks being overwhelmed in all-out war with Hezbollah, says US"
2691,2024-06-23 11:00:02+00:00,Accusations fly as pro-Israel groups spend big to oust progressive House Democrat
2692,2024-06-23 14:00:10+00:00,Israeli defence minister flies to US for ‘critical’ talks on Gaza and Lebanon
2693,2024-06-23 14:58:44+00:00,"US withholding arms shipments, says Netanyahu, days after Washington denies claim – as it happened"
2694,2024-06-23 16:40:57+00:00,IDF investigates soldiers who tied Palestinian man to vehicle’s bonnet
2695,2024-06-23 17:14:58+00:00,"Texas woman allegedly tried to drown Palestinian-American girl, aged 3"
2696,2024-06-24 05:00:19+00:00,"Will Gaza affect the election? In Ilford, I saw the ways it already has | Nesrine Malik"
2697,2024-06-24 10:48:59+00:00,Birmingham election candidate apologises for ‘deeply disturbing’ remarks about women
2698,2024-06-24 11:00:27+00:00,Israeli documents show expansive government effort to shape US discourse around Gaza war
2699,2024-06-24 13:59:47+00:00,"Israel-Gaza war: ‘My life’s mission is to thwart establishment of Palestinian state,’ says Israeli minister – as it happened"
2700,2024-06-24 14:02:02+00:00,"Toys, spices, sewing machines: the items Israel banned from entering Gaza"
2701,2024-06-24 16:17:45+00:00,"Intense phase of Israel’s war with Hamas nearing end, says Netanyahu"
2702,2024-06-24 17:00:21+00:00,"One in five households in Gaza go whole days without food, draft UN report says"
2703,2024-06-25 04:00:05+00:00,‘The grey zone’: how IDF views some journalists in Gaza as legitimate targets
2704,2024-06-25 07:56:16+00:00,City of Sydney could tear up contracts with suppliers targeted by boycott Israel campaign
2705,2024-06-25 08:59:35+00:00,Labor says ‘no mandated sanction’ after senator crosses floor – as it happened
2706,2024-06-25 09:00:03+00:00,Some think a robust anti-war movement in Israel is impossible. They’re wrong | Etan Nechin
2707,2024-06-25 09:06:07+00:00,Labor senator Fatima Payman says each step ‘felt like a mile’ after crossing floor to back Palestine motion
2708,2024-06-25 09:29:23+00:00,Israeli court rules ultra-Orthodox men must be drafted for military service
2709,2024-06-25 10:14:06+00:00,‘An incredible loss for Palestine’: Israeli offensive takes deadly toll on journalists
2710,2024-06-25 11:08:23+00:00,First Thing: Assange leaves UK after striking deal with US justice department
2711,2024-06-25 12:00:25+00:00,Bye Bye Tiberias review – heartfelt memoir of Palestinian family reunion in Galilee
2712,2024-06-25 13:26:18+00:00,‘People feel very betrayed’: the British Palestinian out to unseat Labour’s Wes Streeting in Ilford
2713,2024-06-25 14:05:28+00:00,Middle East crisis: Israeli supreme court ends military exemption for ultra-Orthodox Jews – as it happened
2714,2024-06-25 18:26:54+00:00,The starvation of Gaza is a perverse repudiation of Judaism’s values | John Oakes
2715,2024-06-25 22:04:29+00:00,"Norfolk Southern wrongly burned chemicals after Ohio train derailment, agency says"
2716,2024-06-26 01:03:22+00:00,Labor will not expel Fatima Payman for crossing floor to support Palestine motion
2717,2024-06-26 02:23:09+00:00,Progressive ‘Squad’ member Jamaal Bowman loses New York House primary
2718,2024-06-26 13:00:18+00:00,Dutch foreign ministry calls in Israeli ambassador over ICC spying claims
2719,2024-06-26 15:00:22+00:00,Labor group praises Fatima Payman for upholding party ‘principles and policy’ to cross floor
2720,2024-06-26 15:00:23+00:00,The Aipac-funded candidate defeated Jamaal Bowman. But at what cost? | Ben Davis
2721,2024-06-26 17:25:14+00:00,The Guardian view on Netanyahu’s leadership: making enemies and clinging to far-right friends | Editorial
2722,2024-06-26 17:49:00+00:00,SXSW ends US Army partnership after backlash from artists over Palestine
2723,2024-06-26 19:32:46+00:00,Efforts to sell ‘Anglo neighborhoods in Israel’ at LA synagogue erupt in protests
2724,2024-06-26 20:28:39+00:00,Jamaal Bowman’s primary defeat leaves progressives angry at role of Aipac
2725,2024-06-27 02:21:23+00:00,"The Crunch: AI power drain, balloons across Korea and UK rivers flood with sewage"
2726,2024-06-27 04:00:27+00:00,Hassan Nasrallah: the man who has led Hezbollah to the brink of war with Israel
2727,2024-06-27 05:17:45+00:00,Penny Wong confirms some in Labor caucus ‘upset’ Fatima Payman crossed the floor on Palestine
2728,2024-06-27 07:51:43+00:00,Socceroos pitted against Japan and Saudi Arabia in World Cup qualification
2729,2024-06-27 10:10:35+00:00,"Nearly 21,000 children are missing in Gaza. And there’s no end to this nightmare | Arwa Mahdawi"
2730,2024-06-27 11:06:45+00:00,Our Baillie Gifford boycotts aren’t about tearing down the arts – they’re about building them up | Tom Jeffreys
2731,2024-06-27 14:06:48+00:00,US Congress faces growing calls to withdraw Netanyahu invitation: ‘a terrible mistake’
2732,2024-06-27 14:08:09+00:00,Israel-Gaza war: Israel warns it could take Lebanon ‘back to the Stone Age’ – as it happened
2733,2024-06-27 18:28:12+00:00,Critically ill children leave Gaza through Kerem Shalom crossing
2734,2024-06-27 22:38:14+00:00,"Northern Ireland politicians clash over health, the union, and Israel-Gaza war in TV debate – as it happened"
