,Date,Headline
1409,2024-02-20 18:44:26+00:00,What is Labour’s new position on Gaza ceasefire – and will it unite the party?
1410,2024-02-20 19:19:03+00:00,The Guardian view on the Israel-Gaza war: politicians must be clear that a ceasefire is needed | Editorial
1411,2024-02-20 20:05:06+00:00,Keir Starmer seeks to head off another Labour rebellion over Gaza ceasefire
1412,2024-02-20 21:00:56+00:00,Corrections and clarifications
1413,2024-02-20 21:45:37+00:00,High court rejects legal challenge over UK arms sales to Israel
1414,2024-02-21 10:29:49+00:00,"Labour’s Gaza amendment is chance to ‘speak with one voice’, says Nandy"
1415,2024-02-21 10:33:54+00:00,Arms maker BAE Systems makes record profit amid Ukraine and Israel-Gaza wars
1416,2024-02-21 11:01:13+00:00,Biden visited East Palestine a year after Trump. This doesn’t bode well | Ben Davis
1417,2024-02-21 11:59:00+00:00,Biden can end the bombing of Gaza right now. Here’s how | Mehdi Hasan
1418,2024-02-21 12:58:19+00:00,Pastor says Welby would not meet him if he spoke at Palestine rally with Corbyn
1419,2024-02-21 14:14:01+00:00,Stakes are high as SNP and Labour wrestle over Gaza ceasefire call
1420,2024-02-21 14:37:38+00:00,Prince William’s Gaza plea raises question of Foreign Office input
1421,2024-02-21 18:10:47+00:00,Gaza aid deliveries paused amid ‘incredible level of desperation’ 
1422,2024-02-21 18:17:33+00:00,Criticising Israel doesn’t mean we are antisemitic | Letters
1423,2024-02-21 19:14:39+00:00,US asks world court not to call for Israeli pullout from Palestinian territories
1424,2024-02-21 19:37:38+00:00,How Keir Starmer averted Gaza ceasefire vote crisis
1425,2024-02-21 19:48:05+00:00,"While people die in Gaza, the UK parliament goes to war over the ceasefire | John Crace"
1426,2024-02-21 20:15:52+00:00,UK to consider suspending arms exports to Israel if Rafah offensive goes ahead
1427,2024-02-21 20:59:08+00:00,Commons speaker apologises after Gaza ceasefire debate descends into chaos
1428,2024-02-22 06:42:50+00:00,Afternoon Update: PM says Coalition ‘just wrong’ on visas; ex-Ten presenter and partner missing; and can you remember these ‘best picture’ films?
1429,2024-02-22 10:04:49+00:00,‘A visual testament to Palestinian society’: inside a powerful new photography book
1430,2024-02-22 10:45:13+00:00,Gaza vote row: minister refuses to back Commons speaker
1431,2024-02-22 12:13:05+00:00,First Thing: ‘Promising signs of progress’ on Gaza hostage deal 
1432,2024-02-22 14:00:21+00:00,From a ‘pause’ to a humanitarian ceasefire: emails reveal why Australia shifted its position on Gaza
1433,2024-02-22 14:10:26+00:00,Hoyle says Gaza debate decision was motivated by threats against MPs
1434,2024-02-22 15:13:58+00:00,"Middle East crisis: Israel seeking ‘right people’ to run Gaza after Hamas, say sources – as it happened"
1435,2024-02-22 16:41:05+00:00,Israeli Eurovision song under ‘scrutiny’ for alleged Hamas attack reference
1436,2024-02-22 16:49:04+00:00,Home Office contractor suspends staff after ‘Israel’ defaced on birth certificate
1437,2024-02-22 17:35:27+00:00,Eurovision should have a Palestinian entrant | Brief letters
1438,2024-02-22 17:58:33+00:00,"US intelligence casts doubt on Israeli claims of UNRWA-Hamas links, report says"
1439,2024-02-22 18:09:19+00:00,Mordaunt meets Labour’s olive twig with theatrical fury after Gaza omnishambles | John Crace
1440,2024-02-22 18:16:33+00:00,Starmer receives mixed Labour reviews for Gaza vote performance
1441,2024-02-22 19:12:56+00:00,"Claims of Israeli sexual assault of Palestinian women are credible, UN panel says"
1442,2024-02-22 19:29:46+00:00,‘Despicable’: British Palestinians react to Commons chaos over Gaza ceasefire
1443,2024-02-22 19:36:52+00:00,Israel wants administrators ‘without Hamas or PA links’ to run Gaza
1444,2024-02-23 15:06:40+00:00,Middle East crisis: Netanyahu presents first official post-Gaza war plan; MSF says ‘there is no health system left in Gaza’ – as it happened
1445,2024-02-23 16:18:08+00:00,New hopes of Gaza ceasefire as Israeli negotiators head to Paris
1446,2024-02-23 17:05:57+00:00,British MPs fearful of violent attacks as tensions over Gaza war increase threats
1447,2024-02-23 17:44:57+00:00,"Hamas and Netanyahu are a curse on their peoples. Yet amid the horror, there is a sliver of hope | Jonathan Freedland"
1448,2024-02-24 13:40:33+00:00,UNRWA suspends aid to northern Gaza amid ‘collapse of civil order’
1449,2024-02-24 15:55:58+00:00,Middle East crisis: Mossad chief in Paris for hostage talks; food protests in Jabalia refugee camp – as it happened
1450,2024-02-24 18:13:57+00:00,Ceasefire talks raise Gaza hopes but 1.5m trapped in Rafah fear the worst
1451,2024-02-24 19:14:02+00:00,London’s Tower Bridge closed due to pro-Palestine demonstration
1452,2024-02-25 06:00:51+00:00,Israel does not act for all Jews | Observer letters
1453,2024-02-25 07:00:50+00:00,The big picture: Petra Bašnáková’s intimate portrait of life among the Palestinian Bedouins
1454,2024-02-25 07:30:50+00:00,"Prince William has pontificated about Gaza, but was David Cameron the right person to plagiarise? | Catherine Bennett"
1455,2024-02-25 08:00:51+00:00,‘People want our government to do something’: Commons Gaza chaos was the day British democracy failed
1456,2024-02-25 10:00:55+00:00,UN’s Palestinian aid agency ‘at breaking point’ after $450m budget shortfall
1457,2024-02-25 15:00:03+00:00,Shoshana review – Michael Winterbottom’s compelling romantic thriller set in 30s Palestine
1458,2024-02-25 15:56:42+00:00,"Middle East crisis live: US, Israel, Egypt and Qatar agree ‘basic contours’ of hostage deal ahead of Hamas talks – as it happened"
1459,2024-02-25 16:11:43+00:00,"Israel should have a voice at Eurovision, says president amid row over lyrics"
1460,2024-02-25 18:15:24+00:00,Michigan governor says not voting for Biden over Gaza war ‘supports second Trump term’
1461,2024-02-25 19:54:56+00:00,"Gaza death toll set to pass 30,000, as Israel prepares assault on Rafah"
1462,2024-02-26 00:04:06+00:00,SNP to push for another Commons vote on ceasefire in Gaza
1463,2024-02-26 13:00:04+00:00,The Michigan Republican party is already in chaos. What will the week bring?
1464,2024-02-26 14:41:39+00:00,UN warns Rafah attack would be ‘nail in coffin’ of Gaza aid as deliveries halve
1465,2024-02-26 16:10:19+00:00,"In Gaza, scouts’ community-building and survival skills are a new lifeline"
1466,2024-02-26 18:00:49+00:00,Charlotte Church denies antisemitism after singing pro-Palestinian song
1467,2024-02-26 19:21:58+00:00,Speaker accused of breaking promise as he rejects call for new Gaza vote
1468,2024-02-27 05:52:06+00:00,Joe Biden hopeful of Gaza ceasefire by Monday as details of proposal emerge
1469,2024-02-27 09:30:17+00:00,"Israel is deliberately starving Palestinians, UN rights expert says"
1470,2024-02-27 11:43:44+00:00,"First Thing: Israel ‘intentionally starving’ Palestinians, UN rights expert says"
1471,2024-02-27 12:00:06+00:00,A ‘Black-Jewish alliance’ in the US? Israel-Gaza war shows it’s more myth than special relationship | Jeff Melnick
1472,2024-02-27 12:49:03+00:00,What we know so far about the draft Israel-Hamas ceasefire deal
1473,2024-02-27 14:54:36+00:00,Hamas and Israel pour cold water on Biden’s hopes of imminent ceasefire
1474,2024-02-27 15:01:00+00:00,"Middle East crisis: Biden comments on ceasefire are ‘premature’, says Hamas – as it happened"
1475,2024-02-27 15:32:39+00:00,Qatar and Egypt ‘will help form new Palestinian technocratic government’
1476,2024-02-27 16:27:44+00:00,"Jon Stewart proposes Israel-Gaza peace plan: ‘Honestly, what is the alternative?’"
1477,2024-02-27 18:14:04+00:00,Justin Welby must listen to Palestinian Christians | Letter
1478,2024-02-27 18:14:14+00:00,"As British Jews, we call for an immediate ceasefire in Gaza | Letter"
1479,2024-02-28 01:41:07+00:00,Michigan primary a test for Biden as key voters turn away over Gaza war
1480,2024-02-28 12:44:04+00:00,‘Uncommitted’ vote in Michigan a warning shot over Biden’s support of Israel
1481,2024-02-28 12:49:56+00:00,Biden wins Michigan primary but sheds support over Gaza
1482,2024-02-28 14:24:17+00:00,"If Biden loses in November, don’t blame voters who are angry over Gaza | Arwa Mahdawi"
1483,2024-02-28 15:09:09+00:00,Middle East crisis: Hamas ‘showing flexibility’ in negotiations with Israel but ‘prepared to continue fighting’ – as it happened
1484,2024-02-28 16:25:17+00:00,UK home secretary may tighten restrictions on protests
1485,2024-02-28 20:01:29+00:00,"One in five pregnant women in Gaza clinic are malnourished, doctors warn"
1486,2024-02-29 05:00:09+00:00,Humanitarian workers face deportation from Israel after freeze on visas
1487,2024-02-29 06:33:45+00:00,Thursday briefing: Could the ‘uncommitted vote’ over Gaza cost Joe Biden at the polls?
1488,2024-02-29 07:00:11+00:00,Rochdale polls open after election contest dominated by Gaza
1489,2024-02-29 07:36:08+00:00,"UK should impose sanctions on two far-right Israeli ministers, says Ed Davey"
1490,2024-02-29 12:00:16+00:00,Five of the best books to understand the Israel-Palestine conflict
1491,2024-02-29 19:02:32+00:00,Justin Welby expresses ‘deep regret’ at refusal to meet Palestinian pastor
1492,2024-02-29 19:27:27+00:00,Middle East crisis: Biden says killing of more than 100 Palestinians near aid trucks will complicate ceasefire talks – as it happened
1493,2024-02-29 19:33:13+00:00,‘We do not have many options’: unease over Israel’s recruitment of Indian labourers
1494,2024-02-29 20:02:11+00:00,"Morning Mail: secretive firm behind Coalition messaging, NZ vape ban defiance, shooting near Gaza aid trucks"
1495,2024-02-29 21:50:46+00:00,What we know about the killing of over 100 Palestinians near aid trucks
1496,2024-02-29 22:56:06+00:00,Media outlets call for protection of journalists working in Gaza
1497,2024-03-01 05:00:48+00:00,"‘They took our home, our land, everything’: Palestinians speak out against settlers on UK sanctions list"
1498,2024-03-01 06:14:31+00:00,"112 dead in chaotic scenes as Israeli troops open fire near aid trucks, say Gaza officials"
1499,2024-03-01 06:24:20+00:00,Australia ‘horrified’ by Gaza humanitarian catastrophe – as it happened
1500,2024-03-01 11:17:16+00:00,"Gaza aid convoy deaths ‘tremendously alarming’, says US | First Thing"
1501,2024-03-01 12:00:07+00:00, Is Biden’s student debt action enough to win back young voters angry over Gaza?
1502,2024-03-01 12:03:04+00:00,‘This is for Gaza’: George Galloway sweeps to victory in Rochdale byelection
1503,2024-03-01 15:03:03+00:00,Middle East crisis: Germany joins calls for Israel to ‘fully explain … mass panic and shooting’ at Gaza aid site – as it happened
1504,2024-03-01 17:34:51+00:00,"Palestinian factions making progress on political unity, Russian minister says"
1505,2024-03-01 18:57:49+00:00,Killed trying to keep his family alive: one man’s death at Gaza aid convoy
1506,2024-03-01 19:32:06+00:00,Israel yet to provide evidence to back UNRWA 7 October attack claims – UN
1507,2024-03-01 21:55:17+00:00,Politicians from 12 countries unite to press for arms ban on Israel
1508,2024-03-02 03:32:59+00:00,US to begin aid airdrops into Gaza but critics dismiss effort as inadequate
1509,2024-03-02 06:00:32+00:00,Israel faces mounting pressure to investigate Gaza food aid deaths
1510,2024-03-02 09:35:21+00:00,Pro-Palestine marches to continue after Sunak ‘extremists’ speech
1511,2024-03-02 16:30:57+00:00,Gaza airdrops might not be necessary if Israel faced more pressure on aid
1512,2024-03-02 17:46:48+00:00,Pro-Palestinian protesters voice disgust at Sunak ‘extremist’ comments
1513,2024-03-02 18:14:43+00:00,"US aircraft carry out airdrops of aid to Gaza with 38,000 meals"
1514,2024-03-02 21:26:53+00:00,"Israel reportedly close to accepting six-week Gaza ceasefire, US official says"
1515,2024-03-02 22:07:02+00:00,Middle East crisis live: UK-owned cargo ship sinks in Red Sea days after Houthi attack; US aircraft carry out airdrops of aid to Gaza – as it happened
1516,2024-03-02 22:22:23+00:00,Pro-Palestinian protesters charged after Sydney Gay and Lesbian Mardi Gras
1517,2024-03-03 06:00:04+00:00,"Israel ‘accepts six-week ceasefire deal’ as Hamas response awaited, US officials say"
1518,2024-03-03 15:00:04+00:00,‘We were constantly in terror’: Israeli hostage tells of captivity in Gaza
1519,2024-03-03 15:43:27+00:00,"Middle East crisis: Ceasefire deal possible within 24 to 48 hours if Israel accepts demands, Hamas official says – as it happened"
1520,2024-03-03 16:55:40+00:00,Hamas delegation joins mediators at Gaza ceasefire talks in Cairo
1521,2024-03-03 17:45:32+00:00,Ultra-Orthodox and far-right parties make gains in Israeli local elections
1522,2024-03-03 21:00:54+00:00,California prisoner donates earnings from 13-cent hourly wage to Gaza
1523,2024-03-03 22:30:02+00:00,UK ministers consider ban on MPs engaging with pro-Palestine and climate protesters
1524,2024-03-04 00:22:10+00:00,Kamala Harris issues sharp rebuke of Israel over ‘humanitarian catastrophe’ in Gaza
1525,2024-03-04 05:00:20+00:00,The US is enabling mass slaughter in Gaza – Europe can act to change that | Alexander Hurst
1526,2024-03-04 06:40:47+00:00,Monday briefing: The obstacles still in the way of an Israel-Hamas peace deal
1527,2024-03-04 11:00:28+00:00,How Gaza activists in Minnesota are pushing the US wave of ‘uncommitted’ votes
1528,2024-03-04 13:36:09+00:00,"Aid corridor needed urgently to prevent famine in north Gaza, says WFP official"
1529,2024-03-04 15:01:10+00:00,Middle East crisis: 16-year-old boy reportedly killed during Israeli raid near Ramallah – as it happened
1530,2024-03-04 22:09:34+00:00,"US calls on Hamas to accept ceasefire terms now, says White House – as it happened"
1531,2024-03-04 22:16:54+00:00,Hamas negotiators under pressure to produce list of hostages to be released
1532,2024-03-04 23:29:47+00:00,UN finds ‘convincing information’ that Hamas raped and tortured Israeli hostages
1533,2024-03-05 10:00:31+00:00,‘My period has become a nightmare’: life in Gaza without sanitary products
1534,2024-03-05 10:00:33+00:00,Girl Scout troop disbands after parent chapter blocks Palestine fundraiser
1535,2024-03-05 11:24:04+00:00,First Thing: UN finds ‘convincing information’ that Hamas raped and tortured Israeli hostages
1536,2024-03-05 15:00:29+00:00,Middle East crisis: Hamas set to stay in Cairo for ceasefire talks; Israel says Hezbollah ‘aggression’ bringing ‘critical point’ nearer – as it happened
1537,2024-03-05 17:33:53+00:00,UN experts condemn Israeli ‘massacre’ of Palestinians collecting flour
1538,2024-03-05 18:02:17+00:00,We’ve been calling for peace in Palestine – these sinister Tory proposals would silence us | Ben Jamal
1539,2024-03-05 18:30:09+00:00,"The Guardian view on starvation in Gaza: Palestinians need solutions, not symbols | Editorial"
1540,2024-03-05 18:42:23+00:00,"Palestinians ‘beaten and sexually assaulted’ at Israeli detention centres, UN report claims"
1541,2024-03-05 20:00:01+00:00,Arsenal criticised after Jewish fans walk away over pro-Palestine rally outside stadium
1542,2024-03-05 21:38:23+00:00,Gaza ceasefire talks appear to stall days before Ramadan
1543,2024-03-06 05:41:13+00:00,Afternoon Update: Children allegedly cable-tied in Broome driveway; West Gate protesters jailed; and UN report describes abuse of Palestinians
1544,2024-03-06 08:00:12+00:00,I asked colleagues about starvation in Gaza. They said there is no precedent for what is happening | Devi Sridhar
1545,2024-03-06 12:36:00+00:00,Gaza ceasefire protest vote gains traction in US on Super Tuesday
1546,2024-03-06 15:35:46+00:00,Middle East crisis live: EU working on maritime humanitarian corridor to support people in Gaza – as it happened
1547,2024-03-06 16:38:00+00:00,Food aid convoy for northern Gaza looted after delay at Israeli checkpoint
1548,2024-03-06 17:00:57+00:00,‘Artists will not stand for this’: musicians drop SXSW in support of Palestine
1549,2024-03-06 19:34:12+00:00,Taxpayers foot the bill after academic’s libel action against UK minister
1550,2024-03-06 21:27:35+00:00,Cameron describes talks with Israeli minister over Gaza as ‘tough but necessary’
1551,2024-03-06 23:21:02+00:00,US uses loophole to keep 100 arms sales to Israel under the radar amid Gaza war – report
1552,2024-03-07 08:00:06+00:00,"Sidelined over Gaza war, Mahmoud Abbas faces growing calls to quit"
1553,2024-03-07 09:16:07+00:00,Malaysian PM calls on Albanese to reinstate UNRWA funding to aid ‘besieged civilians’ of Gaza
1554,2024-03-07 11:57:58+00:00,First Thing: Gaza hunger grows as pressure builds on Israel to facilitate aid
1555,2024-03-07 15:09:04+00:00,Middle East crisis: Hamas says ceasefire talks continue despite delegation leaving Cairo – as it happened
1556,2024-03-07 16:36:25+00:00,"A dark pattern runs through British politics: when the powerful lose control, protesters suffer | Owen Jones"
1557,2024-03-07 18:23:30+00:00,"Israel will resist pressure to halt Rafah attack, says Netanyahu"
1558,2024-03-07 19:40:04+00:00,UK science secretary received government advice before Hamas tweet
1559,2024-03-07 20:07:37+00:00,"Morning Mail: mulch company’s court move, Biden proposes aid port for Gaza, nuclear power challenges"
1560,2024-03-07 21:43:42+00:00,Israel to compete at Eurovision song contest after changing lyrics to its entry
1561,2024-03-08 00:09:12+00:00,‘Who is going to distribute it?’: the key flaw in US’s plan to build aid port in Gaza
1562,2024-03-08 04:25:14+00:00,Biden announces US will build pier on Gaza shore for large-scale aid delivery
1563,2024-03-08 11:02:46+00:00,"Calling Gaza protesters extremist risks dividing UK, says government adviser"
1564,2024-03-08 14:00:05+00:00,Open letter to Sunak condemns ‘crackdown’ on right to protest
1565,2024-03-08 15:22:33+00:00,Middle East crisis: UN’s expert on torture investigating claims Palestinian detainees were mistreated in Israel – as it happened
1566,2024-03-08 17:39:54+00:00,‘Israel in his heart’: why Biden ignores growing anger over the Gaza offensive
1567,2024-03-08 17:49:35+00:00,Two artists withdraw work from Barbican show in row over Gaza talk
1568,2024-03-08 18:11:54+00:00,Five killed and 10 injured in Gaza aid airdrop when parachute fails to open
1569,2024-03-08 18:21:40+00:00,EU will open sea corridor to send aid from Cyprus to Gaza amid famine fears
1570,2024-03-09 06:00:24+00:00,‘We need all of them back’: brother of freed Gaza hostage pleads for rest to be returned
1571,2024-03-09 06:00:25+00:00,Thousands expected at London protest calling for immediate ceasefire in Gaza
1572,2024-03-09 10:00:29+00:00,"Maqluba, spicy salad and pickles: Sami Tamimi’s Palestinian recipes for iftar"
1573,2024-03-09 11:13:29+00:00,Biden’s passivity about mass death in Gaza is a moral stain on his presidency | Mohamad Bazzi
1574,2024-03-09 12:00:31+00:00,Harris is reaching Democrats where Biden isn’t – on abortion and Gaza
1575,2024-03-09 14:00:33+00:00,Opposing oppression is a feminist act – don’t look away from Gaza | Arwa Mahdawi
1576,2024-03-09 15:13:42+00:00,Aid ship expected to leave Cyprus for Gaza faces logistical delays
1577,2024-03-09 16:22:56+00:00,Middle East crisis: aid ship ‘set to sail from Cyprus to Gaza on new maritime corridor’ – as it happened
1578,2024-03-09 17:02:44+00:00,Tens of thousands of pro-Palestine protesters march through London
1579,2024-03-09 17:50:40+00:00,Gaza aid ship prepares to leave Cyprus as humanitarian concerns grow
1580,2024-03-10 05:00:09+00:00,‘Waiting for the storm’: Israelis and Palestinians fear difficult week as Ramadan starts
1581,2024-03-10 06:00:13+00:00,"Silenced for months, Arab Israeli towns hold first Gaza war protests"
1582,2024-03-10 15:13:33+00:00,"Ramadan in Gaza: ‘We used to adorn our street, now everything around us is bleak’"
1583,2024-03-10 16:03:02+00:00,"Middle East crisis: Egypt in touch with Hamas and Israel to restart ceasefire talks, says report – as it happened"
1584,2024-03-10 19:13:51+00:00,Palestinian town of Jericho names street after US soldier who set himself on fire
1585,2024-03-10 21:12:12+00:00,Gaza food aid ship stuck at Cyprus with ‘technical difficulties’
1586,2024-03-11 03:49:35+00:00,Netanyahu says Biden ‘wrong’ after US president criticises approach to Gaza war
1587,2024-03-11 06:00:22+00:00,UK lawyer to oversee ICC investigation into alleged war crimes in Palestinian territories
1588,2024-03-11 07:00:25+00:00,Eurovision mirrors how countries see one another. That’s why I can’t watch Israel take part | Jeffrey Ingold
1589,2024-03-11 11:00:28+00:00,The story of Gaza’s destruction in 100 lives – a visual guide
1590,2024-03-11 12:00:28+00:00,Next stop for Democratic ‘uncommitted’ vote campaign for Gaza: Washington
1591,2024-03-11 12:00:28+00:00,Pro-Israel group spent millions in tight race for southern California House seat – and lost
1592,2024-03-11 12:03:25+00:00,Netanyahu rejects Biden’s criticism of his approach to Gaza war | First Thing
1593,2024-03-11 13:33:49+00:00,Hundreds of Palestine supporters protest Israeli real estate event at New Jersey synagogue
1594,2024-03-11 15:07:48+00:00,Middle East crisis: European Commission ‘hopeful’ first boat from Cyprus carrying aid to Gaza will set sail soon – as it happened
1595,2024-03-11 17:21:21+00:00,Israeli human rights groups accuse country of failing to abide by ICJ’s Gaza aid ruling
1596,2024-03-11 20:07:42+00:00,FA to ask amateur football club to remove Palestine corner flags
1597,2024-03-12 05:45:38+00:00,A Ramadan ‘unlike any other’: Gaza grief casts a shadow over Sydney night markets
1598,2024-03-12 08:00:03+00:00,Australia’s foreign minister warns Israel will continue to lose support unless it ‘changes course’
1599,2024-03-12 11:21:40+00:00,First Thing: Charity aid vessel sails from Cyprus as Gaza on brink of famine
1600,2024-03-12 12:10:36+00:00,First aid ship to Gaza leaves Cyprus port in pilot project
1601,2024-03-12 12:12:00+00:00,Red Sea crisis: US carries out six ‘self-defence’ strikes against Houthi targets
1602,2024-03-12 14:54:20+00:00,"Middle East crisis: Israel and Hamas ‘not near a truce’, says Qatar; Biden ‘devastated’ US-Israeli citizen killed in 7 October attack – as it happened"
1603,2024-03-12 15:51:48+00:00,"Palestinian aid agency funding will stay frozen until reports received, says UK"
1604,2024-03-12 16:33:15+00:00,US citizen thought to have been taken hostage in Hamas attack reported dead
1605,2024-03-12 18:24:14+00:00,UK pressing for ‘full explanation’ of alleged abuses after Gaza hospital raid
1606,2024-03-12 18:55:29+00:00,Palestinian citizen of Israel granted UK asylum in case said to be unprecedented
1607,2024-03-12 19:17:12+00:00,Neve Campbell returning to Scream franchise after controversies
1608,2024-03-12 19:49:12+00:00,"Morning Mail: Serco’s secret algorithm, abuse claims over Gaza raid, Greens’ demand on offshore gas"
1609,2024-03-13 00:28:15+00:00,Palestinian boy killed by Israeli police during clashes in East Jerusalem
1610,2024-03-13 11:15:03+00:00,‘Our families are dying’: outrage as program fails to bring Palestinians to Canada
1611,2024-03-13 15:08:31+00:00,"Middle East crisis: scores injured as aid warehouse is hit, says Unrwa – as it happened"
1612,2024-03-13 22:40:01+00:00,Ship carrying aid nears Gaza as Cyprus puts second vessel on standby
1613,2024-03-14 05:00:11+00:00,‘We’re easy to scapegoat’: Muslim Council chief baffled by Tory ‘extremism’ label
1614,2024-03-14 05:39:13+00:00,State Library Victoria staff accuse management of ‘censorship and discrimination’ over pro-Palestine authors controversy
1615,2024-03-14 10:00:17+00:00,Revealed: How the global oil industry is fueling Israel’s war on Gaza
1616,2024-03-14 11:14:59+00:00,Freed Israeli hostage describes ‘psychological warfare’ by Hamas captors
1617,2024-03-14 15:59:46+00:00,Washington and Georgia protest votes raise pressure on Biden over Gaza war
1618,2024-03-14 18:09:59+00:00,Charity hopes to send second food aid ship to Gaza in next few days
1619,2024-03-14 18:38:15+00:00,Charlotte Church’s Big Sing was not antisemitic | Letters 
1620,2024-03-15 05:05:35+00:00,Australia reinstates funding to Unrwa to provide aid in Gaza
1621,2024-03-15 07:24:31+00:00,Australia to investigate how Palestinians crossed Gaza border after government suspends visas
1622,2024-03-15 08:33:25+00:00,"Israeli forces kill 20 Palestinians waiting for aid, Gaza health ministry says"
1623,2024-03-15 11:30:01+00:00,First Thing: Israel accused of killing 20 awaiting aid after Schumer says Netanyahu ‘has lost his way’
1624,2024-03-15 14:00:37+00:00,"Palestinians who had Australian visas cancelled mid-flight are ‘collateral damage’, charity group says"
1625,2024-03-15 16:29:49+00:00,Muslim leaders in Chicago spurn meeting with Biden officials citing Gaza war
1626,2024-03-15 17:23:56+00:00,Netanyahu approves Rafah attack plans as aid ship reaches Gaza
1627,2024-03-15 18:27:44+00:00,Middle East crisis: Gaza aid ship from Cyprus begins offloading food; US stresses need for Rafah plan that protects civilians  – as it happened
1628,2024-03-15 18:32:34+00:00,"Romantasy, AI and Palestinian voices: publishing trends emerge at London book fair"
1629,2024-03-15 21:56:54+00:00,Authors withdraw from PEN America festival in protest over Israel-Gaza war
1630,2024-03-16 05:00:04+00:00,‘Everyone has friends in jail’: how Palestinian prisoners became central to Gaza ceasefire talks
1631,2024-03-16 13:00:05+00:00,Are progressive politics the real reason why US lawmakers are spooked by Tiktok? | Arwa Mahdawi
