,Date,Headline
3601,2024-10-02 10:35:21+00:00,Iranian strikes on Israel: what happened and why did Iran attack?
3602,2024-10-02 11:36:45+00:00,First Thing: IDF moves more troops into Lebanon after Iranian missile attack on Israel
3603,2024-10-02 13:00:29+00:00,US Jewish groups mark 7 October anniversary amid growing fractures
3604,2024-10-02 13:23:10+00:00,British Jews adjusting to ‘new reality’ after year-long surge in antisemitism
3605,2024-10-02 13:35:28+00:00,"One year on, Gazan families mourn their dead and question what future holds"
3606,2024-10-02 13:58:44+00:00,Starling Bank fined £29m for ‘shockingly lax’ sanctions breaches – as it happened
3607,2024-10-02 16:20:41+00:00,US judge sides with pro-Palestinian students over canceled 7 October vigil
3608,2024-10-02 16:35:51+00:00,Normalisation of Saudi Arabia-Israel relations depends on two-state solution | Letter
3609,2024-10-02 17:45:08+00:00,Israel able to repel Iranian attack without need for major help from allies
3610,2024-10-02 18:00:52+00:00,Iran’s ‘axis of resistance’ call for further attacks on Israel
3611,2024-10-02 18:12:24+00:00,Dozens killed in Israeli strikes and ground operations in southern Gaza
3612,2024-10-02 18:52:02+00:00,Eight Israeli soldiers killed in clashes with Hezbollah in Lebanon
3613,2024-10-02 19:50:09+00:00,UK begins evacuating citizens from Lebanon as Israel’s offensive continues
3614,2024-10-02 19:54:11+00:00,"After a fortnight of military triumph, what is Israel’s endgame?"
3615,2024-10-02 21:23:37+00:00,"US would not support Israeli attack on Iran’s nuclear sites, says Biden"
3616,2024-10-03 04:00:06+00:00,Gulf leaders support Palestine – but many would not mind seeing Israel challenge Iran
3617,2024-10-03 05:07:51+00:00,Gulf states call on international community to fulfil responsibilities in the region – as it happened
3618,2024-10-03 06:23:53+00:00,Glenn Druery encourages speculation Fatima Payman will launch her own political party
3619,2024-10-03 06:31:38+00:00,AFP launches ‘prohibited symbols’ taskforce after Hezbollah flags seen at Melbourne rally
3620,2024-10-03 06:34:38+00:00,Afternoon Update: scores killed in Beirut; Sydney Palestine vigil cancelled; falcon chicks hatch in Melbourne
3621,2024-10-03 07:05:28+00:00,Pianist sues Melbourne Symphony Orchestra for cancelling his concert allegedly over Gaza stance
3622,2024-10-03 08:28:42+00:00,Pro-Palestine rally and standing vigil going ahead in Sydney after protesters and police reach agreement
3623,2024-10-03 08:30:15+00:00,Rally organisers and police reach agreement – as it happened
3624,2024-10-03 11:00:05+00:00,Anti-Muslim hate in US rises since 7 October but advocates praise community resilience
3625,2024-10-03 11:33:12+00:00,Six people killed in Israeli strike on central Beirut as 1.2 million in Lebanon displaced by invasion | First Thing
3626,2024-10-03 12:50:45+00:00,Israeli strikes kill nine in central Beirut as blasts heard across Lebanese capital
3627,2024-10-03 15:00:26+00:00,"Protesters wouldn’t have to fight for police permission if NSW had less ‘undemocratic’ system, expert says"
3628,2024-10-03 16:38:37+00:00,What atrocity would Israel have to commit for our leaders to break their silence? | Owen Jones
3629,2024-10-03 17:13:28+00:00,What are the risks involved in Israeli options for retaliatory strikes on Iran?
3630,2024-10-03 17:50:59+00:00,Fifa investigates Israeli ‘discrimination’ after Palestinian FA calls for sanctions
3631,2024-10-03 21:08:25+00:00,"Morning Mail: Israel signals bigger push into Lebanon, anti-corruption raid on parliament, Britain leaves last African colony"
3632,2024-10-03 22:56:00+00:00,Israel orders evacuation of southern Lebanese city as Beirut strikes continue
3633,2024-10-04 02:11:30+00:00,Tim Walz to Muslim voters in push before election: ‘Our hearts are broken’
3634,2024-10-04 04:00:43+00:00,Israel was told ‘you are not alone’ – but year of war has left it isolated
3635,2024-10-04 04:43:05+00:00,Middle East crisis: IDF intercepts ‘hostile aircraft’ from east – as it happened
3636,2024-10-04 04:45:43+00:00,"Israel may launch symbolic attack on Iran nuclear-related facilities, says Ehud Barak"
3637,2024-10-04 05:00:45+00:00,A brutal year and a tale of two Israels: the one that is feared and the one that is fearful | Jonathan Freedland
3638,2024-10-04 07:00:49+00:00,Disabled Palestinians are facing horrors piled upon horrors. I think of their suffering every day | Frances Ryan
3639,2024-10-04 09:00:03+00:00,Daughter of hostage taken captive by Hamas describes her family’s pain and trauma
3640,2024-10-04 09:06:32+00:00,UK Palestinians on the nightmare of watching war unfold from afar
3641,2024-10-04 10:00:04+00:00,"Who is Dovid Efune, leading contender to buy Daily Telegraph?"
3642,2024-10-04 11:00:07+00:00,‘Time stopped here on 7 October’: life in kibbutz that endured unimaginable loss one year ago
3643,2024-10-04 11:00:09+00:00,"In Gaza, we have one question for the rest of the world: aren’t we human, just like you? | A voice from Gaza"
3644,2024-10-04 11:51:18+00:00,Israel launches intense attacks on Hezbollah stronghold in Beirut’s south
3645,2024-10-04 12:00:07+00:00,‘Palestinians are taking the stand’: can legal challenges to Israel’s war in Gaza stop the continuing onslaught? 
3646,2024-10-04 12:24:59+00:00,Israeli strikes hit Beirut as key route out of Lebanon cut off | First Thing
3647,2024-10-04 14:48:29+00:00,Record amount of anti-Muslim abuse reported in UK since 7 October attacks
3648,2024-10-04 15:00:10+00:00,"Visas for Palestinians take median time of four months to process, despite Coalition claims"
3649,2024-10-04 16:01:31+00:00,Israel’s tactical wins against its enemies may prove strategic losses | Sina Toossi
3650,2024-10-04 16:42:57+00:00,West Bank: 18 reported killed in Israeli strike targeting Hamas figure
3651,2024-10-04 19:50:36+00:00,Iran’s Ali Khamenei vows Hezbollah and Hamas will not back down
3652,2024-10-04 21:46:24+00:00,Biden issues terse words to Netanyahu over peace deal and election influence
3653,2024-10-05 03:48:45+00:00,More blasts in Beirut after Israel demands new evacuations – as it happened
3654,2024-10-05 06:00:17+00:00,"One year on from 7 October, our panel considers: what next for the Middle East? "
3655,2024-10-05 06:13:35+00:00,Australia weather: sunny skies expected for most of east coast and NRL grand final in Sydney
3656,2024-10-05 06:39:03+00:00,Blasts shake Beirut’s southern suburbs as Israeli military urges evacuations
3657,2024-10-05 07:00:17+00:00,‘It felt like death was chasing us’: one Gaza family’s attempt to evade Israeli strikes – visualised
3658,2024-10-05 07:00:18+00:00,When will this horror end? When Israel realises that the cost of destroying us is too high | Raja Shehadeh
3659,2024-10-05 13:57:42+00:00,Israel ‘preparing response’ to Iran attack as 7 October anniversary looms
3660,2024-10-05 16:00:27+00:00,A pause for peace is the best the world can hope for in the Middle East’s war without end  | Simon Tisdall
3661,2024-10-05 16:38:48+00:00,Escalation with Iran could be risky: Israel is more vulnerable than it seems 
3662,2024-10-05 16:44:32+00:00,How Gaza sparked the biggest UK protest movement in recent history – and a headache for the police
3663,2024-10-05 17:11:13+00:00,Tens of thousands join pro-Palestinian protests in London
3664,2024-10-05 17:51:08+00:00,Faith leaders unite to reject prejudice on eve of 7 October anniversary
3665,2024-10-05 19:00:34+00:00,‘I’ve aged 10 years in the past 10 days’: Australia’s Shia Muslims watch in horror as Lebanon bombarded
3666,2024-10-06 00:44:58+00:00,"Dutton ‘intentionally lying’ about Australia’s stance on Middle East crisis, Marles says"
3667,2024-10-06 02:30:05+00:00,Night of bombing in south Beirut – as it happened
3668,2024-10-06 04:00:42+00:00,‘I had to evacuate five times’: a year in the life of a Gaza doctor battling to help victims
3669,2024-10-06 04:00:42+00:00,A year of war accelerates ‘silent departure’ of Israel’s elite
3670,2024-10-06 05:00:45+00:00,"The Observer view on Middle East: a year on, there is only one way to a credible peace | Observer editor"
3671,2024-10-06 06:08:14+00:00,Rallies held across Australia – as it happened
3672,2024-10-06 06:15:05+00:00,Heavy strikes hit southern Beirut and Gaza mosque as Israel targets Hamas and Hezbollah
3673,2024-10-06 09:54:55+00:00,UK urges Israel to show restraint amid fears Middle East conflict could spread
3674,2024-10-06 12:00:03+00:00,"As a Palestinian living in the US, I have lost friends, job opportunities – and my faith in humanity | Arwa Mahdawi"
3675,2024-10-06 12:00:06+00:00,‘It’s quite evil’: a US-based Palestinian on the ‘nightmare’ of having family left in Gaza
3676,2024-10-06 14:00:10+00:00,Australian Jews grappling with dissolving unity and the rise in antisemitism a year on from 7 October
3677,2024-10-06 14:00:11+00:00,Albanese acknowledges ‘terrible pain’ of Hamas attacks in video message marking 7 October anniversary
3678,2024-10-06 15:20:53+00:00,Israel’s lack of vision in multi-fronted war may be fatally exposed
3679,2024-10-06 16:07:10+00:00,Netanyahu hits out at Macron over call for halt to arms exports to Israel
3680,2024-10-06 16:17:49+00:00,"Iran seeks to stir up conflict, not avoid it | Letters"
3681,2024-10-06 16:19:27+00:00,The nightmare of being a disabled Palestinian | Letters
3682,2024-10-06 16:20:22+00:00,Western leaders’ silence about Israel’s atrocities gives free rein to Netanyahu | Letters
3683,2024-10-06 16:21:07+00:00,Failed by leaders on both sides in the Middle East | Letters
3684,2024-10-06 17:30:03+00:00,The Guardian view on a year of civilian slaughter in the Middle East: a region in flames
3685,2024-10-06 19:52:50+00:00,"Morning Mail: Albanese marks 7 October anniversary, coalmine damages Indigenous art site, Panthers claim NRL title"
3686,2024-10-06 21:30:03+00:00,Starmer urges unity at home and reiterates call for ceasefire in Middle East
3687,2024-10-06 23:00:33+00:00,Israel on high alert for 7 October as it escalates Gaza and Lebanon conflicts
3688,2024-10-07 00:48:01+00:00,Middle East crisis: Iran confirms resumption of air traffic – as it happened
3689,2024-10-07 02:00:08+00:00,‘A year is just too long’: relatives of Gaza hostages speak of their anguish
3690,2024-10-07 04:00:12+00:00,‘I have to keep going’: mother of Thai worker kidnapped by Hamas prays for his return
3691,2024-10-07 05:00:15+00:00,"It is a year since my mother was murdered at her kibbutz. Out of this horror, surely peace must come | Yonatan Zeigen"
3692,2024-10-07 05:48:57+00:00,"Monday briefing: How the 7 October attacks changed Israel, Gaza and the future of the Middle East"
3693,2024-10-07 06:00:13+00:00,I wish you could see the living nightmare in Palestine. But how much more must we see before something is done? | Nesrine Malik
3694,2024-10-07 06:00:15+00:00,‘Postapocalyptic’: UK volunteer surgeons reflect on time in Gaza 
3695,2024-10-07 06:00:23+00:00,Afternoon Update: one year on from 7 October attack; NT police to search school children; and baby boomers in worse health than past generations
3696,2024-10-07 06:32:26+00:00,Division among Australian politicians easy to see and hear on 7 October anniversary
3697,2024-10-07 09:49:55+00:00,Australian politicians mark 7 October anniversary – as it happened
3698,2024-10-07 10:00:15+00:00,The mainstream media has failed us after 7 October | Peter Beinart
3699,2024-10-07 11:00:21+00:00,A year marked by trauma and grief – and questions about what it means to be Jewish in Britain | Dave Rich
3700,2024-10-07 11:00:22+00:00,‘I’ve lost 20 relatives. I feel helpless’: Palestinian Americans on how their lives have changed since 7 October
3701,2024-10-07 11:00:23+00:00,‘People hold me accountable for a fanatical rightwing government’: Jewish Americans on how their lives have changed since 7 October
3702,2024-10-07 11:03:47+00:00,"Israel marks 7 October with memorials and protests, as attacks on Lebanon and Gaza continue"
3703,2024-10-07 11:09:06+00:00,Jeers for Albanese and cheers for Dutton as leaders join Jewish communities to mark 7 October atrocities
3704,2024-10-07 11:34:05+00:00,‘We refuse to let hatred take hold’: Sydney mourners remember Palestinian and Lebanese lives lost since 7 October
3705,2024-10-07 12:01:02+00:00,First Thing: One year after the 7 October attacks
3706,2024-10-07 12:53:18+00:00,British Muslims deserve safety and belonging. War in Gaza has made us fear we'll lose both | Zara Mohammed
3707,2024-10-07 13:55:26+00:00,‘They told us a big attack wouldn’t happen’: the intelligence failures before 7 October
3708,2024-10-07 14:00:08+00:00,"Pro-war, anti-Netanyahu: that has been the Israeli liberal conundrum in a terrible year | Aluf Benn"
3709,2024-10-07 14:00:12+00:00,Australian health worker in Gaza says conditions ‘worse than you can imagine’ a year into war
3710,2024-10-07 14:07:08+00:00,We must insist that out of the October 7 tragedy must come lasting peace | Jo-Ann Mort
3711,2024-10-07 16:33:04+00:00,‘The pain will never leave’: Nova massacre survivors return to site one year on
3712,2024-10-07 16:39:08+00:00,"Philosophy could help pupils discuss hard topics such as Gaza war, says NEU"
3713,2024-10-07 17:07:34+00:00,Israel launches intense wave of airstrikes on 120 sites in Lebanon
3714,2024-10-07 17:23:12+00:00,World leaders mark first anniversary of 7 October attack on Israel
3715,2024-10-07 17:28:43+00:00,Starmer urges all sides in Middle East to ‘step back from the brink’
3716,2024-10-07 18:17:29+00:00,Protesters for Palestine and Israel rally across US on 7 October anniversary
3717,2024-10-07 19:49:29+00:00,"Morning Mail: world remembers 7 October, poll backs radical cost-of-living action, Australia’s new big thing"
3718,2024-10-07 21:07:05+00:00,Kamala Harris pays tribute to victims of 7 October attacks on first anniversary
3719,2024-10-08 00:39:54+00:00,US warns Israel not to attack Beirut airport – as it happened
3720,2024-10-08 01:22:10+00:00,Trump speaks at 7 October event in Florida – as it happened
3721,2024-10-08 02:03:54+00:00,Trump marks 7 October anniversary and criticizes ‘weak’ Biden and Harris
3722,2024-10-08 02:45:03+00:00,Guardian Essential poll: more than half of Australians approve of Albanese government’s response to Israel-Gaza war
3723,2024-10-08 03:10:54+00:00,NSW premier says police should be able to ban pro-Palestine protests because they are too expensive
3724,2024-10-08 04:00:22+00:00,"One had lived 101 years, the other, just two hours: the stories of Gaza’s oldest victim and its youngest"
3725,2024-10-08 05:00:23+00:00,Dutch prosecutors mull criminal case over alleged Israel interference into ICC
3726,2024-10-08 05:42:20+00:00,‘Shows how small he is’: Dutton’s refusal to support 7 October motion condemned by Labor and crossbench
3727,2024-10-08 07:00:25+00:00,"Today, our hearts are breaking for the children of Gaza. Tomorrow, we must give them peace | Gordon Brown"
3728,2024-10-08 07:55:53+00:00,‘Democracy should not be monetised’: unions revolt against Chris Minns’ plan to ban protests based on cost
3729,2024-10-08 10:07:17+00:00,Australia reviews pro-Palestine activist’s visa after he called 7 October a day of ‘considerable celebration’
3730,2024-10-08 11:40:07+00:00,"The Great Escape festival no longer sponsored by Barclays, after criticism of Israel links"
3731,2024-10-08 12:00:10+00:00,"Rashid Khalidi, America’s foremost scholar of Palestine, is retiring: ‘I don’t want to be a cog in the machine any more’"
3732,2024-10-08 12:06:19+00:00,Hurricane Milton barrels toward Florida as Trump spreads falsehoods | First Thing
3733,2024-10-08 12:41:20+00:00,How does Israel’s Lebanon invasion compare with its previous operations?
3734,2024-10-08 14:00:01+00:00,"As politicians fought over words, Palestinian Australians told of worlds shattered by bombs and blockade"
3735,2024-10-08 14:51:30+00:00,Donald Trump claims to have been to Gaza despite no evidence of visit
3736,2024-10-08 16:30:34+00:00,"Trump secretly gave Putin Covid test machines, Bob Woodward book says"
3737,2024-10-08 16:32:07+00:00,Could Saudi-Iran talks prevent Lebanon from turning into a second Gaza?
3738,2024-10-08 18:06:29+00:00,The Guardian view on Israel and Iran: there will be no winners from an all-out war | Editorial
3739,2024-10-08 22:32:04+00:00,Israeli military deploys fourth division in Lebanon ground offensive
3740,2024-10-08 23:00:04+00:00,‘Survivor’s guilt is overwhelming’: the grief of losing 21 relatives in one airstrike in Gaza
3741,2024-10-09 00:25:15+00:00,Middle East crisis: Lammy to visit Bahrain and Jordan – as it happened
3742,2024-10-09 01:58:32+00:00,The high life: Kamala Harris cracks open a beer with Stephen Colbert
3743,2024-10-09 05:20:05+00:00,TV tonight: terrifying accounts from survivors of the Be’eri kibbutz attack
3744,2024-10-09 05:59:05+00:00,Two students charged after pro-Palestine protest at Western Sydney University
3745,2024-10-09 09:00:10+00:00,Republicans threaten to punish colleges that allow pro-Palestinian protests
3746,2024-10-09 09:24:11+00:00,Sydney restaurateur Alan Yazbek charged over alleged display of Nazi symbol
3747,2024-10-09 11:00:13+00:00,‘I’m not interested in someone passive about Gaza’: how views on the war have changed dating in America
3748,2024-10-09 13:52:34+00:00,Chris Minns faces backlash from Labor MPs over ‘incredibly dangerous’ push to ban costly protests
3749,2024-10-09 15:00:18+00:00,"‘My way of being useful’: for Palestinian oudist Huda Asfour, performance brings catharsis – and frustration"
3750,2024-10-09 17:01:39+00:00,Questions of identity and safety for Muslims and Jews | Letters
3751,2024-10-09 17:56:22+00:00,Biden and Netanyahu speak as Gallant warns of ‘deadly’ surprise attack on Iran
3752,2024-10-10 00:59:49+00:00,Middle East crisis: Al Jazeera accuses IDF of targeting journalists – as it happened
3753,2024-10-10 01:47:53+00:00,"At least 400,000 people trapped by Israel’s latest Gaza offensive, says Unrwa"
3754,2024-10-10 04:00:33+00:00,"‘I am physically here, but mentally in Gaza,’ says lecturer now living in UK"
3755,2024-10-10 06:09:24+00:00,Guardian Australia scores eight Walkley award nominations for excellence in journalism
3756,2024-10-10 09:00:14+00:00,"Facing war in the Middle East and Ukraine, the US looks feeble. But is it just an act? | Adam Tooze"
3757,2024-10-10 10:23:20+00:00,Hurricane Milton slams into Florida as nearly 3 million without power | First Thing
3758,2024-10-10 11:22:43+00:00,"Religious hate crimes at record levels in England and Wales, official figures show"
3759,2024-10-10 12:11:21+00:00,How a year of war laid waste the Gaza Strip – visualised
3760,2024-10-10 14:00:13+00:00,NSW police union pushes back at premier’s suggestion pro-Palestine protests divert resources from crime
3761,2024-10-10 15:21:07+00:00,Kremlin confirms reports Donald Trump sent Vladimir Putin Covid tests
3762,2024-10-10 17:34:33+00:00,UN peacekeepers in Lebanon say Israel has fired on their bases deliberately
3763,2024-10-10 18:35:23+00:00,‘Catastrophic situation’ at children’s hospital as Israel renews Gaza attacks
3764,2024-10-10 19:04:21+00:00,Iran general’s whereabouts in question after Israeli strikes on Hezbollah
3765,2024-10-10 20:00:32+00:00,Corrections and clarifications
3766,2024-10-11 00:31:16+00:00,Sky News’ Sharri Markson tells Benjamin Netanyahu Labor is ‘hostile’ to Israel in ‘confidential’ meeting  | The Weekly Beast
3767,2024-10-11 01:13:14+00:00,"At least 22 people killed in deadliest Israeli strike on central Beirut since start of war, officials say – as it happened"
3768,2024-10-11 03:52:43+00:00,Israeli strike on Beirut kills 22 in deadliest attack on city centre since war’s start
3769,2024-10-11 08:37:25+00:00,Sydney restaurateur Alan Yazbek ‘unreservedly’ apologises after being charged over alleged display of Nazi symbol
3770,2024-10-11 10:00:51+00:00,The US won’t run for another term on UN human rights council. Israel is likely why | Kenneth Roth
3771,2024-10-11 10:04:55+00:00,First Thing: Death toll climbs as Florida grieves Hurricane Milton’s destruction
3772,2024-10-11 13:54:12+00:00,Keir Starmer urged to sack extremism adviser over alleged conflicts of interest
3773,2024-10-11 15:19:06+00:00,Han Kang’s books sell out as South Korea celebrates her Nobel prize in literature
3774,2024-10-11 16:00:02+00:00,Why has Israel detained American journalist Jeremy Loffredo? | Seth Stern
3775,2024-10-11 16:09:03+00:00,UK remains distant from any Israeli plan to attack Iran | Patrick Wintour
3776,2024-10-11 16:20:50+00:00,"US-made munition used in Israeli strike on central Beirut, shrapnel shows"
3777,2024-10-11 19:48:07+00:00,Two Lebanese soldiers killed in Israeli airstrike hours after UN peacekeepers HQ fired on
3778,2024-10-11 21:06:55+00:00,Feedback loop: the tangled ties between the US election and the Middle East war
3779,2024-10-11 23:00:11+00:00,"For the Palestinians who fled to Australia, the home they deeply miss no longer exists"
3780,2024-10-11 23:16:43+00:00,Middle East crisis: Nicaragua breaks diplomatic relations with Israel – as it happened
3781,2024-10-12 03:35:57+00:00,"Israeli strikes kill dozens in Gaza’s Jabalia refugee camp, officials say, as thousands remain trapped"
3782,2024-10-12 15:30:28+00:00,Artistic freedom in our theatres is being lost to fear and self-censorship | Kate Maltby
3783,2024-10-12 17:36:40+00:00,‘The fear is unspeakable’: airstrikes on northern Gaza leave hundreds of thousands with nowhere to go
3784,2024-10-12 23:00:39+00:00,How Australia’s political parties have split over Israel and Gaza
3785,2024-10-12 23:24:01+00:00,Middle East: African Union joins UN member states in expressing support for Guterres – as it happened
3786,2024-10-13 05:00:46+00:00,Dead children were no props in Gaza
3787,2024-10-13 05:44:12+00:00,Wong says Coalition ‘pretty extreme’ to stand at odds with US on Middle East ceasefire
3788,2024-10-13 06:00:47+00:00,"Dear Howard Jacobson, don’t let historical hatreds hide Israel’s cruelty | Louise Adler"
3789,2024-10-13 07:00:52+00:00,Israel is not ‘saving western civilisation’. Nor is Hamas leading ‘the resistance’ | Kenan Malik
3790,2024-10-13 09:00:50+00:00,"Hunger in Lebanon could soar amid Israeli onslaught, UN expert warns"
3791,2024-10-13 11:16:42+00:00,Israel orders more evacuations in Lebanon and threatens medics who treat Hezbollah members
3792,2024-10-13 14:10:48+00:00,‘We fear Gaza will be forgotten’: Palestinians despair as focus shifts to Lebanon
3793,2024-10-13 18:03:48+00:00,UN mission says Israeli tanks forcibly entered base in southern Lebanon
3794,2024-10-13 18:56:20+00:00,SNP expels MSP over ‘utterly abhorrent’ comments on Israel-Hamas conflict
3795,2024-10-13 23:56:46+00:00,Hezbollah drone attack kills four IDF soldiers as US prepares to send missile system to Israel
3796,2024-10-14 00:04:21+00:00,Four Israeli soldiers killed in Hezbollah drone attack – as it happened
3797,2024-10-14 04:29:29+00:00,Labor MP Peter Khalil says Melbourne office has unbearable ‘stench’ after being vandalised with Hamas symbol
3798,2024-10-14 07:00:13+00:00,Dfat says it has told Israel ‘unacceptable’ targeting of UN personnel in Lebanon must cease – as it happened
3799,2024-10-14 10:00:19+00:00,‘Blood on Biden’s hands’: family of US citizen killed by IDF demand justice
3800,2024-10-14 10:07:19+00:00,Time is running out for Kamala Harris to break with Biden on the Gaza catastrophe | Moira Donegan
3801,2024-10-14 10:59:39+00:00,Hezbollah drone attack kills four IDF soldiers as US prepares to send missile system to Israel | First Thing
3802,2024-10-14 11:00:42+00:00,US officials attend Gaza aid meetings on site of Israeli prison accused of ‘horrific’ torture
3803,2024-10-14 11:38:26+00:00,Hezbollah stands at a crossroads – its next steps will determine Lebanon’s fate | Bilal Saab
3804,2024-10-14 12:58:52+00:00,"Anti-Zionist beliefs ‘worthy of respect’, UK tribunal finds"
3805,2024-10-14 14:53:33+00:00,New York Sun owner begins exclusive  talks to take over Telegraph
3806,2024-10-14 15:00:10+00:00,‘They will vote against Harris’: Arab Americans in Michigan desert Democrats over Gaza
3807,2024-10-14 17:53:55+00:00,US intervention points to growing concerns over Israel’s air defences
3808,2024-10-14 20:00:37+00:00,Corrections and clarifications
3809,2024-10-14 20:14:16+00:00,Police arrest pro-Palestinian protesters outside of New York Stock Exchange
3810,2024-10-14 21:12:12+00:00,Israeli airstrike kills more than 20 in northern Lebanon as UN peacekeeping row grows
3811,2024-10-14 23:12:22+00:00,"Israeli attacks on UN forces in Lebanon must stop, say UK, Italy, France and Germany – as it happened"
3812,2024-10-15 05:20:05+00:00,TV tonight: Nadiya Hussain’s magical tips for your food leftovers 
3813,2024-10-15 06:00:07+00:00,Ireland's peacekeepers in Lebanon are putting their lives on the line. I know – I was one of them | Tom Clonan
3814,2024-10-15 07:25:43+00:00,"Australia ‘appalled by the unacceptable deaths of innocent civilians’ in Gaza, Wong’s office says – as it happened"
3815,2024-10-15 11:03:43+00:00,Gaza at risk of becoming ‘graveyard of international law’ – Palestinian lawyer
3816,2024-10-15 12:52:08+00:00,What is Unifil and why has Israel been firing on its positions in Lebanon?
3817,2024-10-15 13:28:02+00:00,Giorgia Meloni plans Lebanon visit as fears grow for UN peacekeeping troops
3818,2024-10-15 14:00:34+00:00,"Temporary Australian visas for Palestinians a first step but longer stay options needed, advocates say"
